Medientyp,Autor,Titel,Titelliste,Kategorie,Code,Letzter Nutzer,Verleihdatum,Regal
CD,Ildiko Krebs,Versuchen sicher.,Deshalb voll um schlafen alt ihm suchen.,Horror,1589591106333,Etta Dussen van,2024-03-26 11:08:12,Regal-2
CD,Prof. Birger Etzler B.Eng.,Wetter jung.,Sich sprechen gleich Nacht auch.,Punkrock,8226888527671,Ria Keudel-Eigenwillig,,Regal-8
DVD,Erkan Mielcarek,Schlafen dich voll zurück.,,Comedy,0552227362145,Tatiana Löchel,,Regal-7
Buch,Prof. Falko Martin B.Sc.,Hinter zwei Platz Freund Pferd.,,Roman,978-0-18-802608-5,Siegbert Ditschlerin,2024-07-31 03:55:38,Regal-4
CD,Ing. Brita Schwital,Land als vorbei.,Tier unser schicken mich Himmel rund.,Comedy,5040525959334,Ralf-Peter Pruschke-Oderwald,2024-06-06 22:40:26,Regal-9
Buch,Richard Juncken,Schwimmen bald.,,Sachbuch,978-0-491-94231-7,Univ.Prof. Jochem Ruppersberger B.A.,2024-06-22 23:06:44,Regal-7
CD,Univ.Prof. Ferenc Haase,Spät wollen Leute Teller heraus.,Tief einmal Zahl groß an.,Pop,6680541595476,Ortrun Gutknecht,,Regal-1
DVD,Katarina Kambs,Hier ohne oft.,,Comedy,7204342553146,Fredo Kreusel,,Regal-7
DVD,Abdul Mans B.Eng.,Heiß weil Brot Eis.,,Sachbuch,8285171637121,Peter Süßebier,2024-05-13 04:35:28,Regal-5
DVD,Dipl.-Ing. Lilija Paffrath,Fenster Baum Ferien Sonne.,,Pop,9322644404961,Aline Löchel B.Eng.,2024-08-28 11:28:35,Regal-10
CD,Dipl.-Ing. Christian Aumann B.Sc.,Sache erklären.,Land schlafen Stück dann traurig Kind steigen stark.,Punkrock,8544227529026,Lina Junck,2024-01-01 02:05:50,Regal-2
DVD,Dipl.-Ing. Silva Sontag MBA.,Affe leise.,,Punkrock,9689113192621,Ing. Oliver Schulz,2024-03-17 14:38:14,Regal-10
CD,Milena Hänel,Durch wichtig.,Nichts rot drei Fenster Fenster in mehr müssen.,Roman,1718923224159,Gesa Kallert,,Regal-10
DVD,Dipl.-Ing. Hanspeter Pruschke,Verkaufen beißen immer Gesicht.,,Comedy,1542956892326,Ilona Caspar,,Regal-10
Buch,Dorothe Vogt,Herr holen fangen.,,Pop,978-1-06-032312-4,Alfredo Wieloch,2024-01-11 02:12:52,Regal-4
Buch,Stefania Mosemann,Braun oben.,,Pop,978-0-411-46611-4,Birgid Pieper-Mälzer,,Regal-2
DVD,Bruno Klingelhöfer,Springen gibt die.,,Punkrock,6464814294163,Univ.Prof. Jovan Seidel,2024-01-19 04:46:56,Regal-10
DVD,Dipl.-Ing. Viktor Geißler,Sache vom nämlich.,,Punkrock,7512564308032,Leander Rudolph,2024-04-12 20:53:01,Regal-8
DVD,Univ.Prof. Johan Drewes,Böse tief den.,,Pop,1397137109690,Carl-Heinz Zänker,2024-04-29 18:41:33,Regal-9
Buch,Nora Dowerg-Matthäi,Glas Loch Herz.,,Roman,978-1-121-67501-8,Miodrag Pruschke,2024-03-14 13:22:41,Regal-5
Buch,Univ.Prof. Gesine Otto,Uns sprechen nämlich Vogel.,,Horror,978-1-67159-475-3,Sibylla Pechel-Seifert,,Regal-10
Buch,Ian Weimer B.Sc.,Geben zusammen Uhr auch alle.,,Sachbuch,978-1-311-89304-8,Dipl.-Ing. Luzie Trommler,,Regal-2
DVD,Vinko Klotz,Hören für Garten Hund Frage.,,Horror,7496034713543,Heinz-Walter Haering,,Regal-4
DVD,Ulrich Hörle MBA.,Kommen Feuer ein.,,Comedy,9821271365787,Janus Radisch,,Regal-5
DVD,Victor Kühnert,Tür seit.,,Punkrock,6886723996714,Norman Hübel,2024-04-06 14:28:29,Regal-7
CD,Ingelore Gerlach,Mal Ball Eltern Tag rund.,Junge wie kalt.,Sachbuch,2432316219612,Josephine Speer,,Regal-7
CD,Mirella Pechel,Berg schaffen Herz.,Hunger heiß Erde Vogel Schule Wohnung.,Comedy,1426435779301,Prof. Gabor Karge,,Regal-7
DVD,Reimar Hettner,Einigen offen grün.,,Comedy,5095091347153,Josip Meyer,,Regal-8
DVD,Friedrich-Karl Hartmann,Fisch werden nach glauben.,,Pop,2631541173342,Ing. Georgios Schacht,,Regal-10
DVD,Frau Wendelin Freudenberger,Acht sehr drehen.,,Horror,7932172489082,Dipl.-Ing. Heinfried Schweitzer,,Regal-6
CD,Dr. Branka Knappe,Fallen schlagen.,Drehen dabei Jahr kein Hund.,Roman,9434340961140,Andrea Plath B.Sc.,2024-02-17 09:07:10,Regal-2
CD,Herr Imre Rose,Langsam Zahl.,Abend möglich groß kennen alle anfangen letzte.,Roman,9181076894302,Carmelo Stroh,2024-04-27 23:45:14,Regal-4
Buch,Henri Kuhl,Sonne Eltern sofort sechs.,,Comedy,978-1-58917-452-8,Ing. Gerti Pohl,,Regal-2
Buch,Dipl.-Ing. Dragica Keudel B.Sc.,Hängen draußen für unter.,,Horror,978-1-5099-4978-6,Mona Heuser,2024-03-07 19:53:30,Regal-10
DVD,Dipl.-Ing. Jaroslaw Löwer B.Eng.,Tag ja gar einige las.,,Roman,1440714320749,Samuel Gnatz B.Eng.,,Regal-1
CD,Walther Scholz,Ob früh reich Minute weinen.,Nennen ließ schreien Leute anfangen.,Pop,4321509754444,Juan Kobelt,2024-06-28 20:56:46,Regal-7
Buch,Hans-Henning Schäfer,Gestern schön bekommen finden.,,Horror,978-0-9794856-3-3,Dorit Ullrich,2024-08-10 17:10:34,Regal-1
Buch,Lilly Flantz-Gierschner,Dich wer Rad holen.,,Punkrock,978-1-4710-2238-8,Käte Wiek,2024-05-06 15:37:47,Regal-4
DVD,Frau Frederike Ruppersberger,Treffen blau Wort.,,Pop,1069647823778,Reginald Häring,2024-02-27 04:32:36,Regal-3
CD,Sigmar Hübel B.A.,Herr Wetter wir.,Sagen dumm jeder machen ich Monat.,Roman,5845291817747,Max van der Dussen B.A.,,Regal-7
Buch,Prof. Marina Heinz,Kommen drei essen.,,Pop,978-1-111-48083-7,Zeljko Fröhlich B.Eng.,,Regal-9
CD,Hildegund Rädel MBA.,Ball schenken.,Natürlich Wort trinken los Stadt traurig Katze.,Pop,5387131022619,Zita Cichorius MBA.,2024-01-06 17:16:33,Regal-1
DVD,Frau Wilhelmine Scholz,Langsam leise hat.,,Horror,5244506957597,Ilka Kraus-Textor,2024-05-03 13:29:29,Regal-8
Buch,Ing. Reinhilde Gorlitz,Fünf wollen wohnen.,,Comedy,978-0-231-61325-5,Felicitas Girschner,2024-09-24 04:09:47,Regal-4
Buch,Prof. Edgar Klemm,Mama wird ließ hin.,,Sachbuch,978-1-84810-291-0,Dr. Marica Röhricht B.Sc.,2024-01-04 19:52:51,Regal-3
CD,Karl-Friedrich Neuschäfer,Hinein was müde.,Hunger offen Stunde gestern erklären ganz Oma.,Comedy,4451619152530,Siegward Binner MBA.,,Regal-5
DVD,Prof. Wojciech Meister B.Eng.,In schaffen gehören.,,Comedy,9681640366865,Gunda Schleich,2024-02-22 03:29:13,Regal-10
Buch,Anto Klingelhöfer,Wohnung letzte dann.,,Punkrock,978-1-183-37608-3,Dipl.-Ing. Ottokar Faust B.Eng.,2024-03-04 15:49:13,Regal-4
CD,Prof. Irmengard Harloff,Fisch schwer Mutter.,Bleiben mit Sache hart nur neben doch.,Sachbuch,1840411994067,Univ.Prof. Christl Hein B.Eng.,2024-06-16 12:24:59,Regal-6
Buch,Dr. Andres Kramer B.A.,Schwarz Mensch dich.,,Punkrock,978-0-297-67092-6,Pascale Margraf B.Sc.,,Regal-5
DVD,Inka Niemeier,Fährt gewinnen dabei.,,Roman,4332973188888,Univ.Prof. Gotthilf Krebs,2024-05-12 02:27:11,Regal-10
DVD,Hella Kambs-Schmidt,Mögen Frau erzählen.,,Punkrock,4235615494036,Jens-Uwe Nohlmans,2024-01-08 08:26:52,Regal-6
CD,Nuri Dehmel MBA.,Zwischen baden dauern Meer.,Gewinnen Schwester dazu frei hin brauchen fressen dort.,Roman,3736285118570,Georgia Ebert,,Regal-3
DVD,Dipl.-Ing. Margitta Jüttner B.A.,Hier Berg.,,Roman,2124272515784,Eckehard Fischer-Gute,,Regal-4
DVD,Dipl.-Ing. Kamil Wagenknecht B.A.,Am heraus Pferd Mutter sich.,,Comedy,4323402036993,Univ.Prof. Karl-Hans Nohlmans,,Regal-2
Buch,Herr Hartmut Heinrich B.Sc.,Meer Himmel neu.,,Comedy,978-1-5106-5649-9,Yusuf Sager-Grein Groth,2024-01-18 07:45:49,Regal-3
Buch,Annemie Neuschäfer,Für halten los.,,Pop,978-0-241-58500-9,Ing. Simon Eckbauer B.Sc.,,Regal-9
Buch,Dipl.-Ing. Jasmin Hölzenbecher B.Eng.,Von Hund tun danach.,,Pop,978-1-4868-3232-3,Hans-Albert Kitzmann,,Regal-9
Buch,Gerald van der Dussen-Heser,Besser schreien Schwester Land.,,Horror,978-0-271-57561-2,Gislinde Wieloch,2024-02-23 02:38:25,Regal-8
DVD,Inken Schwital,Hund ab nicht.,,Pop,0624925052977,Caren Thies,,Regal-3
Buch,Dr. Editha Schleich,Luft warten weil Auto antworten.,,Sachbuch,978-0-232-28721-9,Dr. Alberto Müller,,Regal-2
DVD,Wenke Losekann B.Eng.,Antworten langsam los Affe.,,Horror,7627810427761,Frau Belinda Klingelhöfer,2024-01-02 04:15:42,Regal-9
Buch,Ernst-Dieter Meister,Fast richtig doch heraus kalt.,,Roman,978-1-4366-2092-5,Adriana Stroh,2024-04-13 22:40:37,Regal-4
DVD,Mareile Beckmann,Warten schnell trinken.,,Roman,7286404633195,Herr Hugo Hermighausen,2024-07-03 17:33:29,Regal-4
Buch,Pedro Trommler,Sonntag fragen finden.,,Horror,978-0-421-70398-8,Auguste Rudolph,,Regal-8
Buch,Wibke Beier-Trommler,Unten vier Mutter wirklich.,,Punkrock,978-1-896945-67-5,Matteo Gutknecht,,Regal-1
Buch,Ramazan Kreusel-Lindau,Schwarz ihm Zeit stellen einfach.,,Sachbuch,978-1-393-41957-0,Bela Junck,,Regal-10
CD,Ivan Förster,Neben Zimmer mit verlieren.,Bauen lange essen den einmal.,Horror,5751753517622,Eberhardt Häring,,Regal-9
CD,Herr Hermann Lorch B.Eng.,Verstehen kochen rund weiß in.,Klettern Apfel ich schwer allein dein über.,Horror,6052154402654,Antonietta Wagenknecht,,Regal-1
DVD,Trudel Lange-Wilms,Monate weg unser nichts neu.,,Sachbuch,6317933522016,Dipl.-Ing. Ansgar Zimmer,2024-03-28 04:13:08,Regal-2
CD,Zenta Bohnbach,Letzte durch vergessen lange.,Gibt einige früher lesen offen sehen.,Horror,3843173341399,Hans-Ludwig Hellwig,,Regal-8
DVD,Dr. Babett Zobel MBA.,Müde Stelle finden offen.,,Roman,8781426719791,Luigi Girschner,,Regal-4
DVD,Ria Killer,Besser hinter.,,Roman,9144144284764,Camilla Kraus B.A.,2024-03-04 12:28:58,Regal-5
CD,Stefania Reuter-Patberg,Abend Name Küche draußen.,Nacht Sonntag heißen ließ jetzt.,Roman,6205305819379,Mohammad Krause,2024-03-17 17:24:52,Regal-1
CD,Hans-Michael Zorbach,Wagen braun Zimmer treffen Berg.,Dafür leicht er scheinen Nase weit.,Horror,3742615267085,Herr Adolf Scheuermann,,Regal-6
CD,Olena Wiek MBA.,Wenig Sonne braun.,Können Arzt lachen Tür Schule was offen.,Roman,0094459594043,Dorothea Ditschlerin B.A.,2024-08-23 17:53:56,Regal-3
Buch,Hansgeorg Neuschäfer,Nun sprechen Monate etwas stark.,,Horror,978-0-02-217033-2,Erdal Dietz,,Regal-2
CD,Univ.Prof. Michail Staude B.Eng.,Fressen oft wir.,Ferien unten setzen Sache schon.,Pop,3421033480947,Hans-Heinrich Kusch B.A.,,Regal-3
Buch,Ing. Dorothea Flantz B.Sc.,Jetzt legen.,,Sachbuch,978-1-84198-801-6,Janus Weinhold,,Regal-6
DVD,Irmtrud Kohl,Lange braun Vogel.,,Roman,8500018839057,Hans-Bernd Römer,2024-08-27 20:28:58,Regal-3
DVD,Adele van der Dussen,Schreiben sehen um mehr waschen.,,Comedy,3858923663607,Dipl.-Ing. Hans-Heinrich Ebert B.Eng.,2024-06-16 22:48:21,Regal-6
Buch,Dipl.-Ing. Hanne-Lore Schottin,Andere kommen lachen gelb.,,Horror,978-0-629-64078-8,Reinhardt Mende-Pölitz,,Regal-6
DVD,Marianne Hethur,Fliegen davon.,,Horror,5958865499789,Hans Josef Langern,2024-02-06 02:36:33,Regal-3
CD,Betti Köster,Sprechen erst Wissen.,Beim dürfen mit See der trinken.,Sachbuch,1135677972059,Monika Lindau B.Sc.,2024-02-09 14:03:30,Regal-4
CD,Hansjoachim Hellwig,Baden langsam stellen.,Kalt fliegen Monate her halten schwimmen.,Comedy,8478909452237,Univ.Prof. Armin Jungfer,,Regal-9
DVD,Erica Koch-Finke,Allein schicken leicht ihr.,,Pop,4790180396265,Prof. Vanessa Trommler B.Sc.,,Regal-2
DVD,Herr Xaver Losekann,Am der.,,Pop,0300300381671,Prof. Ingetraud Beier MBA.,,Regal-4
CD,Gerald Heser-Weimer,Hören Nacht Feuer kurz.,Brot dir sagen alt nimmt warm.,Sachbuch,0961691925334,Frau Anna-Maria Roskoth,,Regal-2
CD,Angelo Seip,Was sprechen.,Doch Vater ziehen.,Horror,9507152094921,Karl-Jürgen Mälzer,2024-09-15 05:49:57,Regal-2
Buch,Ildiko Boucsein B.A.,Sieht aber.,,Pop,978-0-931936-30-2,Jörg-Peter Rosenow,2024-01-09 08:32:14,Regal-9
Buch,Guido Reuter,Werden wohl nass spät.,,Punkrock,978-1-877277-36-8,Stefanie Ladeck-Klemt,,Regal-3
Buch,Antoinette Köhler-Rogge,Zwischen gehören.,,Roman,978-0-591-33679-5,Frederike Mosemann,,Regal-5
DVD,Balthasar Losekann,Kam turnen fiel kennen dick.,,Horror,3370610582515,Inka Pruschke-Holzapfel,,Regal-1
Buch,Kreszentia Berger,Fröhlich klettern nächste.,,Horror,978-0-501-84900-1,Reinhart Römer,2024-09-23 12:08:43,Regal-1
CD,Prof. Claus-Peter Stiebitz MBA.,Unten dort ins jetzt.,Flasche vorbei Wagen noch rufen alle.,Comedy,5296754821878,Guido Margraf,,Regal-1
Buch,Dr. Rabea Täsche MBA.,Feuer einigen warum.,,Punkrock,978-0-9753213-6-2,Ekaterina Wirth,,Regal-5
Buch,Alla Mans,Oma Stein Wiese.,,Punkrock,978-0-451-55059-0,Univ.Prof. Carin Birnbaum,2024-04-27 08:34:10,Regal-9
CD,Wolf Juncken,Teller schaffen Fuß hin fallen.,Ferien nach legen Schiff.,Pop,7143183535747,Reinhardt Hettner,2024-07-11 10:25:23,Regal-3
DVD,Aribert Säuberlich-Gude,Spielen schauen.,,Sachbuch,5458313184170,Michaela Reinhardt-Kaul,,Regal-7
Buch,Friedl Hänel,Junge rennen gut nächste.,,Sachbuch,978-1-149-09282-8,Ansgar Heuser,,Regal-7
CD,Prof. Friedl Rädel,Arzt bin Tier sie.,War kam Ferien vergessen verstecken heute.,Sachbuch,1080772292789,Tomislav Hein,2024-04-17 17:46:48,Regal-8
DVD,Alfons Hethur,Erschrecken bin Schluss damit.,,Roman,5297923582248,Romy Rädel-Pieper,2024-07-19 10:13:58,Regal-1
CD,Lilija Kallert,Angst erzählen Mädchen.,Oft verkaufen Auge Fahrrad.,Sachbuch,1412567513432,Leonhard Jäntsch MBA.,2024-07-27 11:45:59,Regal-1
DVD,Folkert Schmidt MBA.,Warten halten singen.,,Sachbuch,4782689659873,Renato Säuberlich,2024-07-27 18:34:56,Regal-4
CD,Annette Täsche,Denn laufen hoch.,Machen einfach liegen Junge Wetter rechnen öffnen erklären.,Punkrock,1363204330632,Bartholomäus Flantz,,Regal-2
CD,Christos Berger B.Sc.,Hund traurig halten Land.,Nass hinein möglich genau verkaufen werfen selbst nicht.,Roman,9868763494709,Margaret Höfig,2024-09-11 06:32:40,Regal-9
CD,Prof. Anika Putz B.Eng.,Hat einigen reich.,Hängen krank sprechen Sache Stunde dafür.,Roman,7168399640412,Rolf-Peter Barkholz,2024-04-27 20:11:48,Regal-10
CD,Simon Kroker MBA.,Küche richtig arbeiten nämlich wenn.,Sitzen Bruder kein Mutter.,Pop,4002112104153,Ing. Senol Hermighausen,2024-09-09 07:52:00,Regal-4
DVD,Univ.Prof. Jennifer Klemt B.Sc.,Seit draußen mein ihm Spaß.,,Punkrock,9734913859950,Heinz-Dieter Beyer,,Regal-3
CD,Paul-Heinz Striebitz B.Eng.,Singen lachen gelb.,Wissen treffen voll Maus beim war unten verlieren.,Punkrock,6136697601771,Mike Walter,,Regal-9
DVD,Ehrenfried Rogge,Haus ganz wünschen Finger.,,Comedy,4244163914828,Norma Schenk B.Sc.,2024-07-15 12:26:19,Regal-6
DVD,Sabrina Hesse-Herrmann,Brot warm lassen Luft wahr.,,Roman,5368109829850,Kathi Hiller-Reuter,2024-09-22 01:17:35,Regal-6
Buch,Emanuel Förster,Wünschen Glas.,,Comedy,978-1-85194-200-8,Willy Zobel,2024-02-03 02:12:14,Regal-10
Buch,Alexa Gertz,Beißen Musik so.,,Comedy,978-0-89565-764-0,Dr. Simona Graf,,Regal-6
Buch,Marzena Holzapfel B.A.,Winter bin.,,Pop,978-0-88501-509-2,Vadim Pohl,,Regal-1
DVD,Dr. Carola Schmidt MBA.,Möglich sie Baum Name allein.,,Punkrock,7357461140206,Telse Ullmann,,Regal-6
DVD,Dr. Nikolaus Hauffer,Verlieren Land.,,Comedy,9913120324509,Hans-Ludwig Eckbauer,,Regal-10
DVD,Prof. Lieselotte Martin B.Sc.,Tot Monate Spaß heute später.,,Roman,8724373157230,Geraldine Franke B.Eng.,,Regal-7
Buch,Dr. Erdogan Dussen van,Acht rufen die sicher.,,Sachbuch,978-1-67589-147-6,Marisa Reichmann,,Regal-2
DVD,Magret Zänker,Katze blau See gelb.,,Horror,7845369986472,Imelda Budig,,Regal-3
DVD,Prof. Rebecca Karz B.Eng.,Schlafen oben Name.,,Sachbuch,4890240222883,Marieluise Trupp-Cichorius,2024-05-07 11:15:54,Regal-10
CD,Gerta Juncken,Fuß tot Zeit dich liegen.,Pferd Licht oben ganz sieben Arzt reiten.,Punkrock,0434602734849,Imre Möchlichen,,Regal-9
Buch,Zehra Lange,Brot Onkel merken.,,Pop,978-1-84301-130-9,Ingetraud Langern B.Sc.,2024-06-28 05:13:52,Regal-9
CD,Lieselotte Dippel,Immer Stadt vom.,Vorbei versuchen heute.,Punkrock,8438713722629,Univ.Prof. Adelinde Martin,2024-02-20 12:42:27,Regal-1
Buch,Hildburg Putz,Bruder gefährlich deshalb Winter.,,Roman,978-0-00-091933-5,Ann Jacob-Rörricht,2024-06-09 02:24:03,Regal-5
Buch,Prof. Gottlieb Sontag MBA.,Sein sollen springen.,,Pop,978-0-652-59052-4,Heide-Marie Lachmann,,Regal-7
Buch,Edmund Weinhage,Leben für gefährlich.,,Roman,978-1-60025-209-9,Nico Ruppert B.A.,,Regal-7
CD,Univ.Prof. Imelda Eckbauer B.Sc.,Schüler Straße gibt Finger.,Halbe fertig dann hart vergessen weg nächste.,Comedy,7052759820739,Erhardt Schäfer,,Regal-7
DVD,Wolfram Häring,Leicht genau Nacht darauf Lehrerin.,,Comedy,3547135409188,Zenon Boucsein-Mosemann,2024-03-22 07:52:22,Regal-2
CD,Herr Metin Stroh,Davon Spaß Bett Oma.,Stück ging Weihnachten wichtig Sonne.,Punkrock,3286454927125,Hanni Dörschner B.Eng.,2024-05-06 02:06:56,Regal-1
DVD,Dr. Marie-Therese Gutknecht B.A.,Papa Ding Loch holen Mama.,,Pop,7110469562285,Susanna Henschel,,Regal-3
DVD,Lisette Söding,Uns nennen weil Bild.,,Horror,5823358859381,Cornelia Caspar-Hauffer,,Regal-5
Buch,Reimund Becker,Hand schlecht fünf weg.,,Sachbuch,978-1-203-39163-8,Frau Anne-Rose Ruppersberger B.Eng.,,Regal-3
Buch,Guntram Gorlitz-Döring,Man wirklich neun.,,Horror,978-1-5192-0195-9,Kunibert Scheibe,,Regal-8
CD,Walburga Schenk,Garten schlimm Wagen böse.,Nicht hängen überall.,Punkrock,0133306656937,Willy Krebs,2024-03-29 01:59:04,Regal-6
CD,Jeannine auch Schlauchin B.Eng.,Fahren dürfen Fisch Leute.,Singen genau neu glücklich Straße sein gehen.,Sachbuch,1873761785610,Dr. Attila van der Dussen B.A.,,Regal-4
CD,Prof. Sabri Rosemann,Auch leise los dürfen.,Schwarz beide holen kurz.,Sachbuch,8267143590559,Irene Schleich B.Eng.,2024-05-28 11:10:35,Regal-1
DVD,Necati Binner,Küche Luft fressen.,,Punkrock,4464631969536,Univ.Prof. Raymund Nohlmans B.Eng.,2024-08-28 01:44:28,Regal-8
CD,Raisa Bähr,Nach Nase oft weg wie.,Wagen sieben bei vom Finger Opa Mädchen.,Horror,2105313030695,Hugo Kohl B.Eng.,2024-05-05 22:00:46,Regal-6
Buch,Herr Arnd Zahn B.Eng.,Scheinen laufen weiter.,,Sachbuch,978-1-4279-0719-6,Evelyne Hertrampf B.A.,2024-09-16 02:17:13,Regal-2
DVD,Univ.Prof. Rosi Gude,Ab Geburtstag Küche.,,Pop,1284019219755,Ekaterina Sager,2024-01-12 10:35:02,Regal-2
DVD,Dana Sorgatz,Spaß Hand.,,Punkrock,1759749685151,Alexa Reichmann,2024-07-05 04:56:27,Regal-3
CD,Janos Renner,Blume wer.,Einigen legen Feuer Stelle rechnen Ende baden.,Roman,9710946091741,Micha Scholz,2024-02-20 09:50:26,Regal-6
DVD,Hans-Hinrich Kabus,Waschen Wetter.,,Sachbuch,4872154719277,Klaus-Dieter Ring,2024-05-31 12:23:25,Regal-2
Buch,Bernhard Kade B.Sc.,Vom also.,,Comedy,978-0-229-41565-6,Stephanie Mitschke-Kraus,,Regal-1
DVD,Dimitri Bolzmann B.Sc.,Einmal fallen.,,Comedy,2212047647492,Dr. Johanna Neureuther B.Sc.,,Regal-5
CD,Alexa Weinhold,Laut Geburtstag.,Durch sehen Fuß Zeitung kann.,Horror,4861650552600,Johanne Riehl,,Regal-2
Buch,Moritz Biggen,Hand unser können gefährlich aber.,,Comedy,978-1-02-987842-9,Guido Linke,2024-01-13 11:03:09,Regal-3
DVD,Prof. Klaus-Jürgen Köster,Licht einigen ja gern Geld.,,Roman,5335342152182,Andree Schmidtke,,Regal-2
Buch,Enrico Drub B.Sc.,Eis Frau schlimm.,,Punkrock,978-1-57846-694-8,Olaf Adolph-Hornig,,Regal-8
DVD,Rudolph Köhler,Wohl Fußball.,,Punkrock,7751033436214,Dipl.-Ing. Patric Eberth MBA.,2024-05-16 12:29:59,Regal-2
DVD,Univ.Prof. Dietrich Textor,Setzen am mehr wissen müssen.,,Punkrock,7889760020472,Nuray Lachmann-Buchholz,,Regal-4
CD,Karola Kraushaar B.Eng.,Hart Bauer früh.,Steigen ganz dort nicht dumm schlagen.,Punkrock,1908893480109,Lara Häring,,Regal-5
Buch,Fanny Mälzer MBA.,Hin Onkel einmal richtig doch.,,Pop,978-1-143-69242-0,Jennifer Nette B.A.,,Regal-2
DVD,Hans-Wilhelm Bohnbach,Name leicht jung dumm.,,Pop,5408965802823,Kunigunde Weimer-Henschel,2024-09-06 18:05:05,Regal-1
CD,Dorle Scheibe B.Eng.,Ihr gar Hase darin lernen.,Hier unten Jahr verstehen.,Pop,0880501731210,Anto Bender,,Regal-9
CD,Liesa Schüler,Sprechen Haare klettern rechnen reiten.,Schicken Minute heißen nämlich öffnen.,Comedy,2585182511240,Katrin Rudolph,,Regal-1
Buch,Wiebke Beckmann,Im Sommer lassen.,,Horror,978-1-79980-074-3,Reinhold Trommler B.Sc.,2024-09-27 13:53:06,Regal-3
Buch,Alla Gorlitz B.A.,Einige nehmen andere.,,Comedy,978-0-09-142450-3,Herr H.-Dieter Wilms B.A.,,Regal-7
Buch,Wilfriede Lange,Fenster Bruder fest Küche hat.,,Roman,978-1-01-839813-6,Klaus-Werner Beyer B.Eng.,2024-05-18 02:16:24,Regal-3
Buch,Adina Preiß,Viel schenken Himmel.,,Comedy,978-0-7948-1745-9,Danica Haase B.Sc.,,Regal-5
Buch,Vittorio Döhn,Plötzlich gefährlich böse sollen.,,Horror,978-1-05-009552-9,Magda Martin-Hermighausen,,Regal-1
CD,Prof. Sigurd Steuer B.A.,Kaufen hören her.,Angst sieht zeigen nun wissen versuchen.,Pop,3044348640204,Tülay Hentschel,2024-09-15 08:40:54,Regal-2
DVD,Heribert Eimer B.Sc.,Sehr neu darin rufen.,,Comedy,0897416262715,Marijan Austermühle B.Eng.,2024-09-06 21:51:52,Regal-5
CD,Elly Wilmsen MBA.,Gehen Himmel Ball Papa Zimmer.,Über hoch sechs allein wahr.,Horror,5127069829962,Fred Kobelt,2024-07-06 08:45:47,Regal-10
CD,Irena Meister,Bald Teller.,Tief immer gestern bald fangen.,Punkrock,8165224937500,Ilka Margraf,,Regal-3
Buch,Claas Peukert-Schenk,Springen es oben endlich.,,Pop,978-0-7405-6624-0,Anna-Maria Wernecke,2024-04-19 18:58:28,Regal-1
DVD,Hans-Bernd Oderwald,Kein nichts unser schwarz.,,Pop,7751080751186,Lioba Briemer,2024-03-21 09:44:08,Regal-5
DVD,Anne-Kathrin Schmiedt-Sölzer,Ging Schule.,,Horror,9716490879804,Heinz-Gerd Graf,,Regal-7
CD,Kevin Kambs,Oma schaffen schlafen.,Oder Meer Monat.,Horror,7868438610184,Hansjoachim Ditschlerin,2024-08-23 20:53:47,Regal-10
CD,Werner Ziegert B.A.,Name Erde setzen.,Hinter Dorf beißen Tür bin Opa.,Roman,2692452920982,Dr. Remo Briemer MBA.,2024-06-23 00:50:30,Regal-7
CD,Ira Gieß,Fest ob.,Buch Maus deshalb.,Pop,5971509560126,Ing. Rico Zorbach B.Sc.,2024-06-25 11:44:03,Regal-7
Buch,Raissa Klemm-Henck,Nimmt wichtig in Abend erklären.,,Comedy,978-0-15-922060-3,Dipl.-Ing. Valeska Peukert,2024-01-13 06:23:30,Regal-4
DVD,Lilian Pruschke-Albers,Fahrrad Geschenk dabei Flasche.,,Horror,8465524598907,Ing. Ilja Kabus MBA.,,Regal-8
CD,Brunhild Kitzmann,Braun fährt schreiben Tante.,Lehrerin zur nämlich gelb dumm Haus.,Comedy,9635860348378,Dipl.-Ing. Silja Geisler B.Sc.,2024-08-04 01:50:58,Regal-3
Buch,Meta Junitz,Danach Beispiel Nacht.,,Sachbuch,978-0-264-12196-3,Ester Berger-Jacob,2024-02-27 18:45:20,Regal-9
CD,Kira Jacobi Jäckel,Müssen packen stark kommen voll.,Bild auch Herz wohl und nimmt.,Sachbuch,4013902325573,Helen Kühnert B.Sc.,2024-06-26 01:24:25,Regal-3
CD,Czeslaw Neuschäfer,Einigen Woche frei.,Oft jeder Platz Arzt Schiff.,Horror,0251849140277,Philomena Beyer-Mies,2024-03-19 14:16:33,Regal-4
CD,Antonietta Junck-Klemt,Frau schon wer Musik.,Fallen oder dick den.,Horror,0659709100674,Czeslaw Atzler B.Eng.,2024-03-28 01:13:08,Regal-4
Buch,Melissa Kohl,Vor Musik kochen wieder Winter.,,Roman,978-1-58250-426-1,Tim Täsche MBA.,2024-07-23 06:29:49,Regal-3
CD,Celal Döring-Schmiedt,Frage Mädchen fahren.,Nicht trinken Sommer Teller Geld hin Wald.,Punkrock,2228222718222,Jozef Becker B.Sc.,2024-04-11 07:52:23,Regal-8
CD,Walburga Trubin,Polizei Schluss ist.,Wenig spielen kurz können merken Licht Name.,Comedy,6898683845063,Diane Naser B.A.,2024-04-20 11:34:05,Regal-9
Buch,Olav Klemm,Wiese bringen nie heiß.,,Roman,978-1-4829-9139-0,Dietmar Möchlichen,,Regal-5
Buch,Dr. Marcella Roskoth B.A.,Bin denken brauchen antworten.,,Comedy,978-0-381-90347-3,Berit Hamann,2024-03-16 16:58:10,Regal-5
CD,Ursel Döhn,Papa fertig stellen.,Draußen warum halten schwarz.,Punkrock,7924291674845,Florentine Zahn,,Regal-9
Buch,Ewald Kambs MBA.,Baden geben gerade fliegen machen.,,Comedy,978-0-518-49078-4,Knud Johann,2024-06-19 23:31:59,Regal-6
CD,Marisa Rogner,Halbe klein erschrecken waschen richtig.,Geschichte an bei schön war.,Sachbuch,4452045011354,Jadwiga Jessel B.Eng.,,Regal-9
DVD,Hans-H. Wieloch MBA.,Schuh auch.,,Sachbuch,5229794033949,Karolin Losekann B.A.,2024-09-03 15:50:52,Regal-6
CD,Folkert Wilms,Machen sofort.,Fiel nennen kalt weil in Rad jetzt.,Comedy,3191112604891,Monique Krebs,2024-04-11 10:31:01,Regal-2
DVD,Hans-Peter Mende,Fußball schwimmen bringen machen Tier.,,Roman,7651693786004,Margit Ebert B.Eng.,2024-09-25 07:11:45,Regal-7
DVD,Herr Reiner Nohlmans MBA.,In ich hin singen.,,Comedy,7523581343302,Herr Mato Peukert,2024-09-27 01:04:54,Regal-3
Buch,Andre Neuschäfer,Traurig fahren baden selbst treffen.,,Punkrock,978-0-263-61226-4,Dr. Ottomar Thanel B.Sc.,2024-01-02 09:47:49,Regal-2
CD,Waltraut Mies,Suchen auch dann vor.,Rennen See etwas gerade.,Punkrock,0563063690880,Tibor Werner,,Regal-1
Buch,Eduard Kühnert MBA.,Machen Minute grün Stück Wasser.,,Roman,978-0-8261-8826-7,Florentine Plath B.Eng.,2024-06-22 12:33:31,Regal-1
DVD,Dr. Ivonne Rosenow,Wo Maus dir klein.,,Horror,7533454747960,Peter-Michael Henk,,Regal-6
Buch,Ferenc Klemt,Möglich Woche nichts Bein.,,Roman,978-0-657-58667-6,Malte Wilmsen MBA.,2024-01-22 18:22:20,Regal-9
CD,Gerolf Mans B.Sc.,Gleich fahren drehen andere unter.,Hilfe springen Geschenk Beispiel jeder ihm.,Comedy,7722197963182,Karsten Kallert,,Regal-9
DVD,Annelene Blümel B.Eng.,Stück fährt also.,,Sachbuch,5852169577368,Adeline Geißler-Becker,,Regal-1
Buch,Herlinde Spieß,Leben Papa nass Geburtstag haben.,,Horror,978-0-679-06914-0,Prof. Ulf Riehl B.Sc.,,Regal-5
DVD,Pirmin Wohlgemut,Maus Mutter sagen aus Minutenmir.,,Sachbuch,3105227397081,Hansgeorg Beyer-Barkholz,,Regal-1
DVD,Frau Elly Nerger B.Eng.,Kind fiel geben Ferien Gesicht.,,Punkrock,5625457308445,Edda Ritter-Sager,2024-06-14 14:39:00,Regal-1
CD,Bertha Noack,Bauen danach dumm das wieder.,Alle schreiben Wetter.,Comedy,5989154992377,Centa Schulz-Drub,,Regal-10
CD,Magdalena Röhrdanz,Ihm dem schnell.,Schwimmen fröhlich Nacht stellen Eltern.,Pop,5436915632626,Cäcilie Fiebig,,Regal-1
DVD,Romy Pärtzelt,Es Straße.,,Sachbuch,6204598975717,Nikolaus Preiß,2024-04-22 17:03:36,Regal-7
Buch,Stephanie Tschentscher,Blume deshalb sein.,,Horror,978-1-274-64413-8,Dr. Christel Holsten B.Eng.,2024-02-25 18:56:58,Regal-1
DVD,August Schaaf,Himmel Brief treffen einigen weit.,,Punkrock,2161032162208,Dr. Gabor Kostolzin B.Sc.,2024-07-21 19:13:33,Regal-4
DVD,Constanze Rohleder,Spaß Milch Beispiel.,,Comedy,1240765680195,Anika Stey,,Regal-2
CD,André Heydrich,Wahr Nase.,Müde Oma sagen öffnen auch Milch sagen.,Pop,2395527732489,Konrad Ditschlerin,2024-07-24 00:33:47,Regal-2
Buch,Greta Kraushaar,Vergessen Mädchen müde denn.,,Roman,978-0-444-34873-9,Eileen Gute-Schaaf,2024-06-09 14:52:12,Regal-5
DVD,Julius Beyer,Name steigen Arbeit.,,Sachbuch,8720976285608,Ing. Brigitta Vogt,2024-09-01 22:25:40,Regal-10
DVD,Karl-Peter Steuer-Nette,Ruhig wird darin gewinnen wo.,,Punkrock,7056157006672,Dr. Mikhail Reichmann B.Eng.,,Regal-7
CD,Dr. Slobodan Ditschlerin,Bauen leise dir Meer vorbei.,See Zeit ruhig Lehrer.,Horror,5945530724086,Miodrag Bender,2024-03-28 15:14:01,Regal-8
CD,Frau Elisabeth Birnbaum B.Eng.,Fallen wahr nass.,Bein schön liegen nein las.,Pop,0953677611485,Melissa Caspar,,Regal-4
