Medientyp,Autor,Titel,Titelliste,Kategorie,Code,Letzter Nutzer,Verleihdatum,Regal
Buch,Hubertus Eberth-Jungfer,Schnee Arbeit noch.,,Punkrock,978-0-560-78909-6,Margot Kohl-Trub,2024-08-02 12:12:57,Regal-3
Buch,Walfried Klemt MBA.,An Zeit schlafen.,,Sachbuch,978-1-212-82051-8,Bernd-Dieter Adler,2024-07-07 12:37:06,Regal-5
CD,Carmine Jähn B.Sc.,Dick Mensch verstehen.,Beide gut dort kennen wirklich.,Pop,9824216955562,Prof. Kathrin Pergande,2024-06-18 01:13:30,Regal-10
DVD,Diana Ortmann B.Eng.,Schnell fest Stein.,,Sachbuch,2860776421397,Ing. Sandor Austermühle MBA.,2024-07-11 12:46:53,Regal-6
CD,Britta Kraushaar,Alle Tier.,Stelle ab Frage schlimm sich Monat nun.,Horror,6477051469447,Pascale Förster,,Regal-1
Buch,Veli Löwer,Hilfe leben haben.,,Horror,978-1-56974-917-3,Arzu Schleich,2024-01-23 21:04:54,Regal-4
Buch,Gabriele Mitschke,Sie ich Vater mehr.,,Punkrock,978-0-279-61536-5,Ilija Beyer,2024-03-03 11:34:56,Regal-8
DVD,Jadwiga Bolnbach B.A.,Brot schaffen Berg Schluss.,,Pop,3828002961313,Jens Werner-Striebitz,,Regal-4
CD,Ingried auch Schlauchin B.A.,Ziehen Name sind.,Lesen in Polizei Loch richtig müde lustig.,Punkrock,5438006228145,Kemal Tintzmann,,Regal-3
Buch,Prof. Corinna Zirme,Seit Zug krank.,,Pop,978-0-422-21442-1,Dragica Schäfer,2024-07-04 22:22:18,Regal-2
DVD,Gunhild Hahn,Helfen lieb Polizei.,,Roman,5195849613094,Sophie Kitzmann,,Regal-10
Buch,Hartmuth Striebitz,Wahr mehr.,,Sachbuch,978-1-5496-1612-9,Filiz Rosemann,2024-07-18 22:58:30,Regal-5
DVD,Beatrix Schleich B.A.,Bauen legen Stein nehmen Kind.,,Roman,4996184792717,Univ.Prof. Heini Hänel,,Regal-9
DVD,Natali Lindner-Kambs,Spaß Opa ihr Arzt.,,Comedy,2670327483299,Jeanette Hornig,,Regal-8
CD,Ing. Gitta Salz,Sonne Schule Stunde.,Dick Bruder ziehen kein weiß gehen.,Horror,0275153780868,Dipl.-Ing. Adelgunde Salz B.Sc.,2024-06-28 22:45:04,Regal-7
Buch,Prof. Pasquale Fröhlich,Schlagen ob verkaufen Fenster dürfen.,,Punkrock,978-0-85795-500-5,Hans-Erich Geisel,,Regal-7
CD,Univ.Prof. Bertha Eckbauer MBA.,Rund Zug ganz.,Nun sicher Nacht sofort rechnen.,Comedy,3495213011320,Juliane Sorgatz,,Regal-2
CD,Jiri Lindau,Luft fehlen unser.,Dunkel Küche sich nach wir.,Pop,0941724214253,Prof. Mona Junck B.Eng.,,Regal-10
CD,Paulo Dörschner,Tür groß geben Minute.,Gab dauern finden freuen.,Punkrock,7156048330104,Beatrice Hecker,2024-01-03 20:26:12,Regal-9
Buch,Heinz-Jürgen Mühle,Schenken Essen spielen.,,Punkrock,978-0-910573-27-6,Bekir Geisel,,Regal-10
Buch,Ingetraut Söding,Tag natürlich schreiben dem.,,Comedy,978-0-327-94789-9,Ljiljana Röhricht-Vogt,,Regal-10
CD,Prof. Marco Keudel,Lehrer Abend frei.,Kommen Blume weinen leise.,Pop,9094414392180,Lissi Ortmann,,Regal-4
Buch,Paulina Schwital,Gott Schuh nennen.,,Sachbuch,978-0-423-03027-3,Massimo Schulz-Trub,,Regal-6
CD,Frau Annemarie Eberhardt,Sommer kochen.,Grün zeigen müde Hase führen.,Roman,7603250967586,Ingelore Schäfer B.Eng.,2024-02-17 06:50:24,Regal-3
Buch,Edeltraut Beyer,Dort Schnee andere.,,Horror,978-0-909861-27-8,Heidelore Tschentscher,,Regal-3
DVD,Leokadia Dippel,Braun lange spielen.,,Punkrock,3676334129808,Luciano Wulf B.Sc.,,Regal-9
Buch,Ing. Traugott Hofmann B.Eng.,Mehr bekommen.,,Sachbuch,978-0-618-77776-1,Prof. Cindy Liebelt MBA.,2024-02-14 03:49:55,Regal-1
Buch,Ullrich Gotthard,Sache reiten jung frei.,,Comedy,978-1-79107-960-4,Lilly Wirth,2024-07-07 12:24:55,Regal-7
DVD,Ivan Sager MBA.,Papa dauern.,,Punkrock,0530588839841,Christos Wulf-Gröttner,2024-04-07 05:13:31,Regal-6
Buch,Gerfried Hänel,Fangen vom Ferien fliegen treffen.,,Horror,978-0-670-81526-5,Christine Roht,,Regal-1
DVD,Celal Reuter B.Eng.,Liegen Minutenmir.,,Comedy,0581257392808,Jose Mühle,,Regal-10
CD,Josefine Kühnert,Wünschen mein in Buch.,Als Eltern gab früh Stelle.,Sachbuch,4064937402173,Doreen Gieß-Schweitzer,,Regal-8
CD,Hildegund Stahr,Wie einige sicher Papa.,Springen zwei Zeitung erzählen jetzt uns Wissen nur.,Horror,5259164504304,Marit Beer,2024-04-11 11:00:02,Regal-1
Buch,Ing. Frauke Neureuther B.A.,Stark doch hin doch.,,Pop,978-1-955100-48-9,Dipl.-Ing. Zoran Peukert B.Eng.,,Regal-2
DVD,Recep Käster MBA.,Denken essen Arbeit waschen natürlich.,,Pop,6700272191966,Dr. Gesine Wirth,,Regal-5
DVD,Univ.Prof. Fadime Lorch B.Eng.,Gegen Vogel.,,Punkrock,6923787519036,Laszlo Harloff,,Regal-6
DVD,Ing. Beatrice Eberhardt B.Eng.,Setzen schwarz.,,Comedy,7900270824852,Maritta Caspar,,Regal-7
Buch,Reinhard Zahn-Girschner,Wieder schreiben.,,Pop,978-0-615-66774-4,Mustafa Stahr,2024-07-19 18:33:29,Regal-1
DVD,Ingried Roskoth,Schlimm freuen gut.,,Roman,3877515996114,Wieland Keudel,,Regal-4
CD,Alma Heintze-Eberth,Auch Baum Herz.,Wieder Papa baden Sommer.,Comedy,4650338208393,Raissa Patberg,2024-01-27 16:51:13,Regal-10
DVD,Ing. Nora Seifert B.Sc.,Jetzt brauchen.,,Roman,2112623162725,Gesa Hübel MBA.,2024-08-18 23:07:27,Regal-3
DVD,Ralf-Peter Eimer,Nun packen versuchen neun.,,Horror,1556652407890,Eleonora Baum,2024-03-29 19:52:06,Regal-6
Buch,Miroslaw Schmidtke,Etwas hoch Zimmer.,,Sachbuch,978-0-555-21645-3,Cathrin Weihmann,2024-09-21 17:11:05,Regal-6
CD,Cilli Oderwald,Gibt Sache schreien.,Rad tief reiten zusammen.,Comedy,4072089084550,Gunhild Neuschäfer,,Regal-5
Buch,Prof. Kunigunde Klemm,Reiten Arzt.,,Punkrock,978-1-281-81909-3,Prof. Anna Ebert B.Eng.,,Regal-5
CD,Friedhilde Textor,Möglich in groß.,Unten endlich mit am nämlich Schule Finger letzte.,Comedy,4474056087340,Kai-Uwe Bruder-Hoffmann,2024-01-06 03:59:52,Regal-6
DVD,Frau Anneliese Caspar,Zeitung Küche.,,Punkrock,2408466478490,Ludwina Junitz MBA.,2024-04-17 18:19:19,Regal-4
Buch,Dr. Aynur Seip,Fast Sonntag Mensch sofort.,,Pop,978-1-333-43293-5,Anatol Adolph,,Regal-3
Buch,Grazyna Pohl-Pechel,Mensch drehen Fuß deshalb.,,Sachbuch,978-0-941539-65-4,Hansgeorg Schottin-Reinhardt,2024-06-19 14:55:58,Regal-10
DVD,Ivanka Kroker,Stück nach Stück.,,Horror,5142881857092,Melanie Biggen B.Sc.,2024-05-27 12:41:00,Regal-1
Buch,Prof. Lisa Häring,Zimmer dafür wohnen.,,Horror,978-0-620-53870-1,Geza Grein Groth B.Eng.,2024-04-18 14:20:50,Regal-7
Buch,Dipl.-Ing. Lisbeth Mans,Merken Milch darin.,,Comedy,978-1-206-39115-4,Prof. Brian Seifert B.A.,,Regal-8
CD,Ahmed Barth,Sehr haben hier nah.,Ist Musik Minute Stein Papa merken wie.,Punkrock,3164226262035,Mariele Liebelt,2024-07-13 12:25:53,Regal-6
CD,Siegrun Niemeier,Vier rechnen stehen.,Ich schicken Schüler Meer grün einige.,Roman,3235293037816,Erich Otto,,Regal-4
CD,Belinda Fiebig,Unter wenn vielleicht Bild fröhlich.,Mädchen natürlich da Stück.,Roman,7665220694434,Abraham Steuer,,Regal-6
Buch,Severin Kühnert MBA.,Platz baden trinken Geschichte.,,Pop,978-1-894838-19-1,Timm Speer,2024-03-06 20:28:31,Regal-2
Buch,Janett Finke-Dobes,Später mich sicher dein.,,Punkrock,978-0-9888109-7-6,Petra Plath B.A.,2024-09-27 01:20:06,Regal-4
Buch,Prof. Birgit Weinhold,Schreiben nächste.,,Comedy,978-0-449-71014-2,Anne-Kathrin Krebs,,Regal-4
Buch,Reingard Süßebier-Kobelt,Tisch damit ruhig zu halten.,,Comedy,978-0-05-394397-4,Niklas Tschentscher B.A.,2024-05-31 16:14:54,Regal-4
Buch,Tabea Bender,Holen rund spät sprechen fährt.,,Comedy,978-1-4472-4956-6,Bernhardine Rosemann,,Regal-2
DVD,Katja Wesack MBA.,Ohne wenn um warten.,,Horror,7384259990095,Aysel Stiffel MBA.,,Regal-3
DVD,Mina Steuer B.Eng.,Straße Papa nächste.,,Comedy,9823911591839,Klaus-Günter Budig,,Regal-1
CD,Dipl.-Ing. Hilmar Gertz B.A.,Gerade sieht.,Hase Geld böse fertig beim Spiel Teller.,Roman,0817985808824,Kathy Jacobi Jäckel-Graf,2024-04-03 15:30:37,Regal-2
Buch,Balthasar Kraushaar B.Eng.,Bekommen bin aus.,,Horror,978-0-7085-2462-6,Dogan Schwital B.A.,2024-05-28 09:08:11,Regal-6
Buch,Prof. Utz Butte,Zusammen da schreien denken im.,,Sachbuch,978-0-419-71650-1,Lothar Säuberlich-Hermann,2024-05-29 03:30:08,Regal-9
Buch,Jörn Seifert,Hunger alt.,,Punkrock,978-0-476-41231-6,Julie Warmer-Mülichen,2024-08-28 09:05:59,Regal-7
DVD,Ing. Wera Bender,Gar denn neben um packen.,,Pop,5121354154821,Ramon Gerlach-Dörr,,Regal-1
CD,Prof. Wilhelm Mans B.Sc.,Öffnen Mädchen.,Doch tun legen durch was.,Roman,6771201509022,Steve Stroh,,Regal-5
CD,Benno Hellwig-Sontag,Schlafen Geld schauen.,Schenken im wirklich ich acht Mann legen.,Pop,5088670850830,Jozef Segebahn B.Sc.,2024-03-05 21:01:42,Regal-10
Buch,Jann Heinz,Abend Himmel sich.,,Horror,978-0-472-20999-6,Uta Kraushaar,2024-09-30 10:37:28,Regal-2
Buch,Hagen Speer,Winter andere danach jetzt Ball.,,Roman,978-1-63510-853-8,Pavel Sager,2024-02-17 08:43:42,Regal-3
DVD,Mareike Hendriks,Mal Pferd nichts später.,,Pop,0022020402466,Heimo Junken,2024-03-25 10:21:59,Regal-10
CD,Helmuth Schäfer,Spiel wichtig gibt.,Wieder heiß Weihnachten schön Ball gelb fest.,Punkrock,4008535414725,Karina Zirme,2024-02-13 04:40:13,Regal-4
Buch,Miodrag Neuschäfer,Spaß sprechen Vogel warum.,,Roman,978-0-658-36971-1,Univ.Prof. Petros Vogt,2024-06-19 03:27:29,Regal-6
