Medientyp,Autor,Titel,Titelliste,Kategorie,Code,Letzter Nutzer,Verleihdatum,Regal
Buch,Sara Butte-Weihmann,Viel schön als lachen gut.,,Punkrock,978-1-397-32852-6,Univ.Prof. Arno Rosenow,,Regal-10
CD,Univ.Prof. Eckhart Hertrampf MBA.,Fest arbeiten.,Schüler hoch rufen Schule davon Minutenmir.,Comedy,0416701969001,Dagmar Rogge,2024-03-02 12:02:14,Regal-2
DVD,Priska Schomber MBA.,Freund bei deshalb ich.,,Pop,1405257955490,Mohamed Albers-Neuschäfer,2024-09-23 11:21:41,Regal-9
CD,Ansgar Wilmsen,Seite gegen gleich.,Tun Land sollen holen nichts.,Comedy,0261610636953,Frau Gundel Heuser MBA.,2024-07-01 08:47:19,Regal-8
DVD,Univ.Prof. Helma Kühnert,Haus lange Schule.,,Pop,3449074593280,Karl-Ludwig Mende,,Regal-7
CD,Bodo Schulz,Heraus eigentlich verlieren.,Vielleicht dein unter Pferd machen sehen Sohn.,Roman,7878151790230,Nevenka Austermühle B.Eng.,,Regal-10
DVD,Ron Löffler,Heute was da nennen.,,Sachbuch,3072870457984,Frau Justine Steckel,,Regal-3
CD,Dipl.-Ing. Diether Stahr B.Eng.,Schüler sprechen.,Maus daran davon Monat sollen.,Roman,3085306844463,Liliane Ernst,,Regal-3
CD,Marta Walter-Hendriks,Dein her.,Beim acht fressen Berg dabei geben stellen.,Comedy,3139584419124,Heinrich Mentzel,,Regal-7
Buch,Ing. Laila Pruschke,Ruhig Haus lange.,,Horror,978-0-566-69746-3,Gert Jüttner,,Regal-7
DVD,Silvio Jacobi Jäckel B.Eng.,Winter fragen auf schauen.,,Roman,5222032958004,Thekla Jungfer,2024-06-28 15:30:05,Regal-8
DVD,Gunnar Bloch-Wagenknecht,Wissen zur brauchen Ding Monat.,,Roman,6214997159953,Raymund Tschentscher B.Eng.,2024-07-08 10:19:12,Regal-3
CD,Jane Wernecke,Wahr gesund beißen.,Waschen kein Sache Boden.,Punkrock,1591216983229,Ing. Kunigunda Bärer,,Regal-10
Buch,Jan Ullrich,Wagen wenn einigen Nase müssen.,,Roman,978-0-13-841339-2,Christa-Maria Birnbaum,,Regal-5
DVD,Frau Grete Albers,Schwimmen nennen fünf.,,Punkrock,3710959425133,Jacob Hecker,2024-08-04 05:22:05,Regal-6
DVD,Krzysztof Schuchhardt B.A.,Geld denn Weg lernen neben.,,Comedy,5590635735286,Annita Krebs-Etzler,2024-09-17 07:48:04,Regal-3
CD,Dittmar Jockel,Ziehen Schluss.,Jung sind sehen ziehen ob gewinnen brauchen.,Punkrock,7601288978925,Eberhardt Jessel,2024-07-16 03:30:43,Regal-9
CD,Dipl.-Ing. Sandro Becker B.Sc.,Jahr versuchen sein.,Eigentlich andere über Wissen Glück gar beim.,Roman,9412357088401,Prof. Hans-Ulrich Drubin B.A.,2024-03-10 09:34:16,Regal-4
CD,Hellmut Kühnert,Hin lustig reiten sollen.,Name rot rennen zeigen was Fuß.,Punkrock,3318703489778,Univ.Prof. Enno Loos B.Sc.,,Regal-3
Buch,Dipl.-Ing. Heinz-Günther Herrmann B.Sc.,Ihn Familie leicht heute.,,Comedy,978-1-05-251257-4,Marian Heß,,Regal-3
CD,Ian Hofmann,Fuß müssen Platz schreiben Auto.,Überall einige bis jeder in.,Pop,8920629543769,Univ.Prof. Waltraud Mies B.Sc.,,Regal-5
CD,Betina Henk B.A.,Vogel offen Monat.,Nase nicht öffnen Zahl zu.,Horror,3694111493355,Ira Dussen van MBA.,,Regal-6
CD,Benno Klemm,Licht hinter sitzen.,Los Vater Feuer ohne.,Horror,6781932561565,Marcus Krause,,Regal-4
DVD,Dr. Saban Mühle,Neben ziehen.,,Comedy,6465575330336,Beatrice Dippel B.Sc.,2024-09-07 01:29:04,Regal-6
DVD,Univ.Prof. Sylvester Steinberg MBA.,Dumm kein reiten beim.,,Sachbuch,5121455538698,Ivo Sorgatz-Scheel,2024-05-01 20:01:55,Regal-3
DVD,Elke Bauer-Junitz,Bald daran finden sicher möglich.,,Pop,0435284084383,Heinz-Willi Söding-Hübel,,Regal-1
CD,Mary Herrmann-Stey,Mein Affe.,Acht erklären sein wahr.,Pop,9624807569525,Ralf-Dieter Trub,2024-08-13 04:54:08,Regal-8
Buch,Dipl.-Ing. Elsa Fliegner B.Eng.,Deshalb erst nicht war.,,Roman,978-0-7971-8288-2,Valeska Holzapfel B.Eng.,2024-06-11 22:52:49,Regal-3
CD,Valentin Huhn,Immer Auto seit Eis Licht.,Essen groß Bruder versuchen Angst schlafen.,Sachbuch,8704385829899,Silvana Metz,2024-08-05 10:16:00,Regal-2
CD,Prof. Lisbeth Koch B.Eng.,Flasche Bein Ding aber.,Zimmer Mann genau gesund turnen gleich wenn.,Horror,3803885662021,Dr. Mandy Keudel B.Sc.,2024-08-12 23:47:13,Regal-6
DVD,Hans-Eberhard Dietz,Neben Weihnachten Wald einmal.,,Roman,7055333527796,Bozena Adler,,Regal-3
CD,Micha Kraushaar,Genau schenken sollen.,Kind dann bei werden jeder schenken sagen.,Sachbuch,4523820914587,Martine Gumprich,2024-03-29 17:50:04,Regal-5
DVD,Frank-Michael Stumpf,Lehrer neu ins ein.,,Roman,0776193928130,Philippe Gotthard,2024-02-10 21:15:33,Regal-10
CD,Rosa-Maria Schmiedecke-Textor,Schwester ins dort warten nicht.,Rad warm verstehen oder lieb wieder sich.,Horror,0848994614076,Lorenzo Wieloch B.Eng.,,Regal-10
CD,Hans-Martin Mohaupt,Freuen dein alt darauf.,Draußen sagen fragen überall.,Comedy,6299006571490,Undine Hofmann,,Regal-5
DVD,Dipl.-Ing. Leonid Atzler B.A.,Hilfe warm bis.,,Horror,1624323436798,Geza Peukert-Koch II,2024-08-09 22:26:24,Regal-5
CD,Zeljko Rörricht,Treffen lustig erst kochen.,Wohnen Himmel vergessen kalt.,Punkrock,9264980182335,Xenia Hörle,2024-02-18 15:55:26,Regal-4
Buch,Ing. Hans-Günther Stiebitz B.Eng.,Jung nächste Eltern oft.,,Roman,978-1-268-64209-6,Justus Seidel,,Regal-3
CD,Dr. Lea Gehringer B.Sc.,Sitzen wohl.,Bauer sechs sitzen stehen.,Pop,8097675421836,Ahmed Zahn,,Regal-4
Buch,Luciano Flantz,Brief endlich schaffen denken überall.,,Horror,978-0-08-834988-8,Heide Schinke,,Regal-8
CD,Kathrin Steckel B.Sc.,Hart zehn.,Hängen schlecht über in denken las.,Horror,3349623069719,Dr. Kirstin Bauer,2024-04-08 05:10:58,Regal-8
Buch,Konstantin Henschel-Rädel,Weit Fahrrad zurück.,,Sachbuch,978-1-63134-488-6,Univ.Prof. Hartwig Drewes,,Regal-2
Buch,Marijan Jessel,Merken Rad rot fressen.,,Roman,978-1-5332-9013-7,Alicja Kambs,2024-03-26 07:00:48,Regal-8
DVD,Hans-Dietrich Pohl B.Eng.,Nennen ins.,,Horror,3419675737536,Rigo Fliegner,2024-03-08 00:40:07,Regal-1
CD,Mirjana Stoll,Wer Vater singen.,Noch Bauer stehen wichtig oft gewinnen Vater.,Comedy,7714037344800,Udo Bachmann-Steinberg,,Regal-5
CD,Univ.Prof. Viktor Huhn B.Sc.,Zurück alle packen arbeiten.,Natürlich Vogel dort lesen Fahrrad Zeitung arbeiten Seite.,Roman,6039754596594,Hans-Jochen Schulz B.A.,2024-07-15 16:49:07,Regal-8
DVD,Hans-Georg Henck,Erde Auto.,,Pop,1570853103313,Frau Änne Karge B.A.,2024-07-20 18:21:49,Regal-9
DVD,Silvester Preiß MBA.,Treffen was jetzt.,,Horror,6195660999284,Dagmar Jungfer,,Regal-6
CD,Arnold Scheibe,Kopf Stelle kaufen Lehrer.,Schlagen nicht gelb lustig Hilfe krank einigen Lehrer.,Horror,1718147945137,Frederike Koch II,2024-05-11 01:08:08,Regal-9
DVD,Walli Weller B.A.,Dazu Auge Tür.,,Roman,3667834382169,Herr Ahmed Köster B.A.,2024-05-19 04:34:53,Regal-10
Buch,Ewald Textor,Ziehen sich Zeitung lustig.,,Punkrock,978-0-221-01613-4,Priska Junk,2024-05-29 14:36:09,Regal-9
DVD,Prof. Stefani Geisler,Freund Hunger.,,Punkrock,3018835770248,Mohamed Hauffer,2024-05-05 23:55:17,Regal-6
Buch,Lambert Dowerg,Einmal schicken.,,Horror,978-0-669-91759-8,Christl Ring,2024-08-15 02:31:19,Regal-10
DVD,Dipl.-Ing. Sandra Steinberg,Anfangen sofort sie.,,Roman,9259301584059,Elisabet Scheibe MBA.,,Regal-4
CD,Hermann Josef Gunpf,Nächste nämlich.,Er Frage Wald bin sicher wenn.,Sachbuch,1757503445676,Anatolij Dippel B.Eng.,,Regal-5
CD,Rudi Gumprich,Zwei kalt.,Also lesen sicher geben jung.,Roman,5620883617079,Milan Dehmel,2024-08-22 05:19:42,Regal-4
CD,Clarissa Barkholz,See sich Nase traurig war.,Gelb Bein baden wünschen sitzen hier.,Horror,4766358935963,Kevin Döhn B.A.,,Regal-3
Buch,Babett Kensy,Erzählen Woche Spaß Junge.,,Horror,978-1-179-81997-6,Kreszenz Hornich,2024-01-18 04:28:31,Regal-2
CD,Ana Fritsch,Suchen ist ab Affe.,Nein Boden sehr fangen da darin.,Sachbuch,4769299017057,Fatima Atzler,,Regal-7
CD,Nick Scheuermann,Rechnen ließ reich nennen.,Schwester beim weg genau Mensch.,Punkrock,8299353422474,Theodora Wagenknecht,2024-08-03 03:27:35,Regal-7
Buch,Prof. Birgit Rörricht,Oma möglich Bild.,,Punkrock,978-1-241-97804-4,Kati Naser-Warmer,2024-05-11 02:55:57,Regal-1
CD,Melitta Biggen,Essen danach.,Andere bleiben fahren Wagen.,Sachbuch,1093789320758,Clarissa Bolnbach,2024-09-24 05:47:36,Regal-7
DVD,Florence Dehmel,Katze Pferd einfach zwischen.,,Comedy,1006430460116,Nico Kostolzin,,Regal-5
DVD,Dipl.-Ing. Sibylla Bähr B.A.,Fliegen verstecken.,,Comedy,3207703518826,Prof. Andreas Stoll,2024-03-21 16:33:05,Regal-8
CD,Jens-Peter Walter MBA.,Leben laufen ruhig.,Gefährlich Stelle Bett packen Apfel schaffen.,Sachbuch,2774810867297,Roderich Peukert B.A.,,Regal-3
CD,Adriane Rohleder-Stey,Neu geben.,Schule Tisch dunkel.,Pop,8646701181437,Käthe Mälzer,,Regal-9
DVD,Miroslawa Kramer,Sommer eigentlich am ihn erschrecken.,,Horror,8753788216829,Frau Lili Holzapfel MBA.,2024-04-23 16:37:57,Regal-9
DVD,Maike Hartung,Erklären sieht.,,Sachbuch,6722564193250,Telse Hermighausen B.A.,2024-01-20 18:30:19,Regal-4
CD,Dipl.-Ing. Wibke Mitschke B.Eng.,Junge Glas Apfel.,Einige blau Garten in Fahrrad kann.,Roman,1624192544648,Emmi Köster-Weinhold,2024-03-25 18:06:39,Regal-1
Buch,Armin Trapp B.A.,Gelb Musik selbst Stein Leben.,,Sachbuch,978-1-05-261071-3,Engelbert Heidrich,,Regal-4
DVD,Bodo Walter,Sache warum Spaß Polizei.,,Sachbuch,8617936463292,Bernhard Stiebitz,2024-07-25 18:45:39,Regal-4
CD,Magret Knappe,Später traurig neun.,Essen geben setzen bald.,Comedy,4074927212187,Frau Luzia Seip B.Eng.,,Regal-4
CD,Malgorzata Roskoth,Braun böse bald.,Gewinnen lachen Hase Kind glücklich Zahl.,Comedy,9179227076677,Dina Tschentscher,2024-03-10 06:13:22,Regal-4
CD,Hanife Preiß,Dorf da.,Heiß weit fallen in Fahrrad.,Sachbuch,1673816471341,Ute Hartung,2024-09-15 22:53:08,Regal-9
DVD,Ottokar Eckbauer B.Eng.,Bein Geburtstag fragen Tag schwer.,,Pop,1101733345112,Gretel Mitschke,2024-07-03 02:20:42,Regal-4
Buch,Clemens Gotthard,Auto zwischen Jahr.,,Punkrock,978-1-219-43491-6,Karlfried Patberg B.Sc.,,Regal-8
DVD,Ortrun Martin,Haben springen Feuer warm.,,Comedy,7505776779981,Florian Jacobi Jäckel,2024-04-20 06:07:26,Regal-10
DVD,Dipl.-Ing. Hüseyin Lange B.Eng.,Immer suchen Mädchen acht können.,,Punkrock,2461846465343,Hansjürgen Drub,2024-08-26 08:55:59,Regal-2
Buch,Mercedes Lange,Stadt machen liegen Minutenmir.,,Comedy,978-1-72707-575-5,Antonino Jungfer-Ritter,,Regal-9
DVD,Arno Kramer,Hilfe durch wohnen.,,Horror,2491891516295,Hans Peter Kohl,,Regal-2
CD,Frau Ernestine Ortmann,Ja Kopf schlafen glücklich.,Beispiel braun wir Kopf Frau Geschenk.,Roman,7316694391892,Enver Stiffel,2024-01-15 19:38:19,Regal-8
Buch,Franz-Josef Hamann,Stark hat Frau.,,Roman,978-0-383-83845-2,Ilias Eigenwillig,,Regal-9
Buch,Holger Harloff-Nohlmans,Kann Eltern neu Sonntag.,,Sachbuch,978-0-15-845391-0,Rico Eckbauer-Freudenberger,,Regal-8
CD,Gretchen Scheibe,Tief schicken das ruhig nass.,Schreiben heraus gefährlich.,Sachbuch,2191684705034,Christine Bien,,Regal-8
CD,Ing. Margarita Dörschner B.A.,Deshalb Bauer.,Kopf Sache wie fiel.,Pop,1059962696355,Hans-Jörg Beer B.A.,,Regal-4
Buch,Hendrik Wesack-Junk,Wetter nur.,,Horror,978-0-434-50910-2,Jacob Pärtzelt-Trupp,,Regal-10
Buch,Concetta Geisel-Pechel,Essen Monat braun.,,Punkrock,978-1-61726-560-0,Hildegunde Schweitzer,2024-06-04 01:48:52,Regal-9
Buch,Esther Heinrich-Jopich,Geld Woche gegen für Gesicht.,,Horror,978-1-63294-170-1,Emanuel Dörschner,,Regal-4
DVD,Augustin Wilms,Licht ließ wohnen.,,Roman,4076518121816,Rita Trüb B.A.,,Regal-1
DVD,Dipl.-Ing. Gretel Schuchhardt,Frei Freund.,,Horror,1530562083306,Prof. Gotthard Rust B.Eng.,,Regal-3
DVD,Mattias Schmidt-Gude,Las Auge überall mehr danach.,,Horror,8660469329429,Herrmann Flantz,2024-02-04 16:06:14,Regal-9
CD,Doreen Dussen van-Tintzmann,Lustig kurz bleiben warten.,Jeder bringen glücklich drei Schüler können.,Punkrock,2010840013656,Karla Flantz,,Regal-1
CD,Dr. Harri Hettner B.Sc.,Sollen Schiff kurz.,Tragen vor Freund will Schluss zehn Geschichte.,Pop,0071697391368,Hans-Bernd Heydrich,2024-01-17 07:05:11,Regal-2
CD,Ing. Vesna Lindau,Das Name wieder werden weinen.,Opa Haare unter also fressen Lehrerin gleich dunkel.,Pop,1221574418094,Alexa Zahn,,Regal-8
CD,Eckhart Rosemann B.Eng.,Ging gesund langsam.,Darauf schenken klettern nass schon.,Comedy,4937417949683,Ing. Eckehard Keudel,,Regal-6
DVD,Steffen Gorlitz,Darauf Sonntag.,,Comedy,5582392906047,Folkert Dowerg B.A.,,Regal-7
CD,Univ.Prof. Emma Riehl,Wohl rufen sprechen sofort Hunger.,Tag Uhr brauchen wichtig weiß Junge Eis.,Comedy,0585543052728,Marit Kuhl,2024-06-07 13:57:25,Regal-9
DVD,Dipl.-Ing. Danny Rosemann B.Eng.,Versuchen alle holen oder.,,Comedy,0928305674309,Mehmet Lange,2024-07-29 09:02:26,Regal-3
Buch,Univ.Prof. Paula Reising,Schicken zehn gehören ging wird.,,Punkrock,978-1-301-10983-8,Mina Hahn-Steinberg,2024-05-14 21:30:17,Regal-2
Buch,Jonas Baum,Rennen Wiese nah aber.,,Comedy,978-0-8387-6861-7,Aleksander Karz-Beyer,2024-08-07 07:36:46,Regal-9
DVD,Stephan Wilmsen,Fest führen mehr.,,Roman,5746329210519,Nils Kallert,,Regal-4
Buch,Dr. Johannes Hartmann MBA.,Halbe sieben hinein neben.,,Roman,978-1-85756-993-3,Frau Karolin Weimer,2024-04-01 10:48:30,Regal-1
DVD,Reimar Förster,Licht Schule.,,Punkrock,2064928676127,Regina Schuster B.Sc.,,Regal-7
Buch,Czeslaw Becker,Ferien Hase Winter.,,Comedy,978-1-86595-797-5,Otto Mälzer-Herrmann,2024-09-02 12:32:43,Regal-3
DVD,Klaus-Dieter Pärtzelt,Zusammen schön hier damit.,,Horror,5227968406896,Rena Beer,,Regal-2
CD,Hüseyin Hahn,Leute mit Tante fliegen Luft.,Schiff zwischen fallen sieht.,Punkrock,8045350430628,Univ.Prof. Corinna Mans,2024-02-18 22:11:32,Regal-4
Buch,Janine Hecker,Einmal das.,,Sachbuch,978-1-4025-3065-4,Dipl.-Ing. Theresa Kroker MBA.,2024-06-26 05:23:06,Regal-10
DVD,Ing. Urs Blümel B.Sc.,Fuß acht Glas.,,Pop,1974204625453,Geraldine Warmer-Gnatz,2024-09-08 09:14:51,Regal-5
DVD,Leif Gehringer-Koch II,Der Frage Junge.,,Roman,8093293999610,Thorsten Finke B.A.,2024-08-25 12:26:17,Regal-9
DVD,Ing. Irene Löchel,Weiter sieht stellen.,,Pop,5613573150734,Prof. Bruni Ullmann,,Regal-8
DVD,Univ.Prof. Klaus Peter Finke B.A.,Bringen allein einmal.,,Pop,8829322737065,Univ.Prof. Dierk Otto B.Sc.,2024-01-19 06:40:27,Regal-10
Buch,Ralf Bauer,Arbeit Nase wollen scheinen.,,Roman,978-1-360-79724-3,Annerose Reuter,,Regal-1
CD,Burkhardt Koch II,Zeitung Küche Schule kalt.,Legen darin Straße schauen.,Horror,1058861074240,Frau Carla Seip,,Regal-5
DVD,Frau Kunigunde Werner B.Sc.,Dabei Monat dem.,,Roman,5372466034840,Prof. Danuta Textor MBA.,2024-08-03 01:30:10,Regal-1
DVD,Dr. Rosina Adler B.Sc.,Fehlen Fenster Herz.,,Horror,1952734708549,Dipl.-Ing. Florentine Rosemann,,Regal-4
Buch,Carmine Mangold,Nah genau dauern.,,Punkrock,978-1-05-093164-3,Ernest Werner,,Regal-7
Buch,Ing. Brian Hesse B.Sc.,Mutter Mutter rund wenig allein.,,Punkrock,978-0-480-32990-7,Prof. Gabor Henck,,Regal-6
Buch,Agnes Dörr MBA.,Schuh Gesicht fährt heiß.,,Sachbuch,978-0-905586-94-6,Klara Köhler,,Regal-2
CD,Rene Trub,Frau verlieren glücklich.,Mit drei fast natürlich führen merken versuchen.,Comedy,9145879068032,Vitus Kroker-Langern,2024-04-27 07:57:48,Regal-5
CD,Janna Haase MBA.,Packen und langsam antworten.,Geschenk den leise beide aus.,Punkrock,8134557116739,Sylvana Steuer,2024-05-14 01:28:16,Regal-4
DVD,Dr. Maritta Ritter B.A.,Geschenk machen Brot Mensch.,,Comedy,9509889036939,Dr. Christos Heintze B.Sc.,,Regal-1
DVD,Alwine Drewes,Tür drei glauben zu.,,Sachbuch,3067628817998,Matthias Klingelhöfer-Pieper,2024-02-05 16:45:18,Regal-7
DVD,Margaret Säuberlich-Ullrich,Jetzt Sohn helfen.,,Sachbuch,1023989947110,Ing. Gilbert Ruppert,2024-08-29 01:20:08,Regal-4
DVD,Ljubica Reuter-Trub,Jung mein hinein fressen.,,Horror,1446787376584,Charles Mohaupt-Gute,2024-07-09 12:30:26,Regal-7
Buch,Janna Henk B.A.,Polizei wollen gab turnen ein.,,Punkrock,978-0-7158-1672-1,Sigrun Noack B.A.,2024-01-06 11:55:36,Regal-6
CD,Cornelius Mies,Darin schreiben gleich gefährlich.,Dir rufen Luft sprechen scheinen.,Punkrock,3397014555808,Gaby Blümel-Stey,2024-06-13 00:26:49,Regal-4
DVD,Maria-Luise Plath,Herz einfach Tante was.,,Horror,4574378235051,Susanna Mälzer B.Eng.,2024-08-13 15:22:18,Regal-7
CD,Babett Sontag,Gleich offen so.,Bin Pferd Sonntag mal Spiel besser.,Sachbuch,8869864718504,Fredi Patberg,,Regal-3
DVD,Dipl.-Ing. Zenon Steckel,Bruder Zeit ohne.,,Punkrock,3319870997790,Wladimir Dehmel,2024-06-30 04:35:28,Regal-8
CD,Brigitta Weimer,Dafür böse fährt.,Hart gehen Tag fangen unter dafür.,Sachbuch,2135610581019,Hans-Willi Seip,,Regal-2
CD,Fredo Schuster,Ist Tante.,Als Feuer Minutenmir Abend draußen Himmel legen.,Horror,6055153132522,Dino Killer,2024-06-14 21:22:19,Regal-2
Buch,Marisa Schulz-Schleich,Erklären erst dich.,,Sachbuch,978-1-935363-89-7,Leon Aumann B.Sc.,,Regal-7
Buch,Folker Noack,Freund braun kochen.,,Sachbuch,978-1-67250-215-3,Prof. Heidelore Butte,,Regal-3
CD,Luzie Tlustek,Tür mögen oben.,Ab helfen erklären dort doch besser.,Punkrock,6241104382904,Gereon Vollbrecht,2024-05-29 01:07:20,Regal-10
Buch,Magnus Höfig-Scholz,Reich noch Fisch oben.,,Horror,978-1-957587-80-6,Anneke Ring,2024-08-30 06:40:17,Regal-1
Buch,Dr. Annedore Tlustek B.A.,Aus schlagen so was.,,Horror,978-0-678-09207-1,Karl Carsten,,Regal-7
DVD,Hans-Adolf Nerger-Fischer,Bald Hand zehn wirklich.,,Horror,8836291121726,Aneta Thies,2024-09-23 20:49:42,Regal-7
DVD,Ursula Jacobi Jäckel,Deshalb ganz weit Sohn.,,Roman,0924993906609,Heidemarie Förster,,Regal-2
CD,Stanislav Speer,Licht rechnen Schluss Lehrerin kein.,Frei Zahl zwei glücklich steigen.,Punkrock,7094748571376,Prof. Yasemin Henschel,,Regal-5
DVD,Florentine Schmidt,Uhr verkaufen durch Zeit Lehrerin.,,Roman,9951702747261,Annegrete Pieper,2024-02-18 04:09:51,Regal-1
DVD,Univ.Prof. Gabriella Schomber MBA.,Zimmer halten brauchen tun nah.,,Pop,1811985790645,Xenia Tröst-Juncken,2024-01-28 22:39:20,Regal-3
CD,Magret Hornig MBA.,Arzt Land ab Stelle.,Sagen nichts Hase lange.,Comedy,0631175427721,Emmerich Hoffmann,,Regal-7
CD,Cäcilia Schomber,Wagen fährt nämlich Kind Arzt.,Welt früher setzen für turnen bauen.,Punkrock,7551867186046,Marieluise Liebelt,2024-06-19 05:49:12,Regal-6
Buch,Claus Budig,Weil gab ging kochen.,,Pop,978-0-494-25200-0,Liliane Langern,2024-05-08 07:05:16,Regal-6
DVD,Sophia Keudel,Zug stellen.,,Comedy,1470920613892,Anne-Katrin Höfig MBA.,2024-06-24 20:06:15,Regal-4
CD,Dipl.-Ing. Ian Hartmann MBA.,Sonntag ließ geben warum.,Eis Ding Milch Stein zwei.,Roman,6265789235003,Valentine Schenk B.Eng.,2024-08-18 15:55:50,Regal-8
CD,Dariusz Berger,Schiff will Erde Frau sechs.,Schlimm wichtig dafür gut Brot wieder.,Comedy,2846000917362,Ewald Drub,,Regal-9
Buch,Univ.Prof. Hedda Bonbach,Teller reiten einigen Wohnung Herr.,,Punkrock,978-0-7809-1874-0,Mareike Briemer,2024-04-14 18:25:07,Regal-1
DVD,Gisela Berger,Ins drei Uhr an.,,Punkrock,6770073505729,Alexandros Wulff,,Regal-5
CD,Enrico Rohleder,Zwei Vater Bett Mann.,Gesicht essen beißen nicht bin fiel bauen.,Horror,8721179240883,Gertraut Hänel-Mohaupt,2024-02-24 12:10:27,Regal-1
CD,Simone Jacobi Jäckel,Klasse uns Stück.,Voll schicken Maus Land bekommen antworten schreien.,Roman,4701450966408,Adelbert Schmidt MBA.,,Regal-7
DVD,Veronika Löchel,Geschenk bauen schwer ruhig dein.,,Roman,3550715684516,Heinz-Günther Biggen,,Regal-3
DVD,Erica Hornich,Daran Platz die.,,Horror,2180064439652,Ekrem Dietz-Adler,,Regal-10
CD,Halil Jessel-Dippel,Glück Wohnung ab.,Kochen braun Wiese leise wie Tür ließ.,Roman,5347313794024,Traugott Juncken B.A.,2024-01-20 00:17:03,Regal-1
Buch,Prof. Ivan Sölzer,Grün leben arbeiten wer auf.,,Horror,978-0-438-12561-2,Gisa Martin,,Regal-3
DVD,Gustav Hörle,Buch Ball nach.,,Comedy,3403135230187,Miodrag Girschner-Scholl,,Regal-6
DVD,Sedat Renner,Langsam turnen gehen schwarz.,,Sachbuch,5910711274865,Ing. Bärbel Mielcarek B.Eng.,2024-02-21 09:30:53,Regal-6
DVD,Berend Weller,Rechnen einigen früh Hilfe werden.,,Roman,1081746219269,Florence Röhricht MBA.,,Regal-4
CD,Sieglinde Ruppert-Hertrampf,Schwer sind.,Schenken dort zwischen.,Roman,6587621120620,Dipl.-Ing. Mariana Stey,2024-02-18 16:47:58,Regal-8
DVD,Ewa Weller,Sicher nimmt ich fahren.,,Sachbuch,2210085261229,Tadeusz Caspar B.A.,,Regal-1
DVD,Hanno Döring,Schluss kann.,,Roman,3997204391720,Theresa Seifert,2024-09-29 12:14:58,Regal-5
Buch,Augustin Holzapfel-Eigenwillig,Frei Schuh packen wo müssen.,,Comedy,978-0-7853-8187-7,Antoinette Sontag,,Regal-5
Buch,Annegret Müller,Sollen schlagen spielen bekommen.,,Comedy,978-0-911747-31-7,Anastasios Fischer,2024-03-04 11:40:19,Regal-9
DVD,Margrit Gotthard,Packen Dorf Teller also lieb.,,Roman,5686538333572,Frau Monica Bruder B.Sc.,2024-05-07 05:25:29,Regal-4
Buch,Dr. Hans Josef Süßebier,Sitzen Stelle Hund Winter.,,Punkrock,978-0-05-354658-8,Lieschen Börner,,Regal-10
Buch,Mary Lindau-Söding,Opa gelb.,,Horror,978-0-02-004890-9,Herr Jörgen Stoll,2024-07-16 22:39:46,Regal-6
DVD,Hilde Hande-Wirth,Hoch spielen Mensch Haare.,,Pop,5632949584638,Michaela Trüb,,Regal-4
DVD,Janett Linke-Striebitz,Finden Flasche Ende singen.,,Pop,9881580332122,Malte Hecker,,Regal-4
CD,Joerg Trub B.A.,Polizei damit schicken.,Hand Glas Ding da später haben.,Pop,9217701078233,Meinolf Ritter-Scheuermann,,Regal-8
Buch,Pascal Liebelt,Weit Erde klettern.,,Sachbuch,978-0-18-116751-8,Valentine Fiebig,,Regal-6
Buch,Hugo Wilms MBA.,Ging jeder Fußball richtig Vogel.,,Comedy,978-0-9551183-3-3,Toralf Mude,,Regal-4
CD,Fernando Kuhl,Herz hier gehören warten.,Nennen Baum sechs tief.,Horror,8391608575949,Annegrete Segebahn-Wirth,2024-04-11 00:42:07,Regal-5
DVD,Prof. Birgid Rädel B.Eng.,Essen werfen es Spiel oder.,,Comedy,7995035482125,Rosl Steinberg,,Regal-1
DVD,Prof. Klaas Heintze B.A.,Jung besser weiß.,,Horror,2672878532945,Diethelm Kambs-Sager,2024-09-06 02:35:50,Regal-8
DVD,Gitta Dörschner MBA.,Wo Mann Fuß Uhr gar.,,Comedy,2730533576007,Erich Dörr B.Sc.,2024-03-15 18:34:47,Regal-9
CD,Metin Söding B.Sc.,Bruder und seit vergessen mal.,Fangen Garten Polizei wünschen turnen laut.,Comedy,9241193060339,Dr. Roselinde Faust B.A.,2024-03-13 15:58:15,Regal-9
DVD,Carmela Hiller-Seidel,Küche Auge reich.,,Pop,9721261763695,Gertrude Dobes MBA.,,Regal-10
Buch,Prof. Klaus-Dieter Trommler B.A.,Etwas hören da.,,Comedy,978-1-4153-7286-9,Tilman Faust B.Sc.,2024-09-20 12:13:22,Regal-6
Buch,Athanasios Jäntsch,Helfen Zug schwimmen werfen sehen.,,Roman,978-1-55770-949-3,Dipl.-Ing. Anette Hartmann B.A.,,Regal-7
DVD,Vinzenz Mülichen,Hand warum Teller sieht sonst.,,Sachbuch,6271278337004,Herr Goran Mangold,2024-06-06 03:00:24,Regal-7
CD,Gerold Bruder,Deshalb rennen sollen vor.,Wenn gehören sind dein Oma nämlich Wohnung.,Punkrock,7111111543881,Wencke Etzler,,Regal-4
CD,Katrin Mitschke,Her immer Seite.,Grün dauern drei geben.,Roman,5483146551790,Frau Priska Meister,,Regal-5
CD,Heinz-Dieter Spieß,Oben wichtig Abend gefährlich damit.,Küche am Hunger Bett.,Comedy,7022804477300,Igor Rohleder-Eberth,2024-08-15 13:31:37,Regal-6
Buch,Kornelius Röhrdanz,Sehr tun Fisch für.,,Horror,978-0-09-349121-3,Iwan Junken-Beer,,Regal-8
CD,Folker Eigenwillig-Hoffmann,Durch zehn.,Uns gehen am sofort damit.,Punkrock,1492177278624,Fredi Bien-Hauffer,2024-05-26 08:36:02,Regal-6
DVD,Jens-Peter Holt-Kensy,Dabei gab beide ihr.,,Roman,5593132614986,Nikolas Hövel,2024-02-16 00:25:42,Regal-1
DVD,Emma Tschentscher,Monate denn.,,Punkrock,9415363617368,Dr. Gudula Drub MBA.,2024-03-26 00:23:06,Regal-2
DVD,Annedore Ortmann,Stark Arzt sieben.,,Horror,7816110380719,Marlen Hecker-Christoph,2024-03-13 21:16:15,Regal-9
DVD,Raik Wesack,Ohne ruhig darauf.,,Pop,0850016823236,Jolanda Klingelhöfer,,Regal-10
Buch,Univ.Prof. Evelyne Buchholz B.A.,Wenn kommen ruhig wissen.,,Sachbuch,978-1-5150-8918-6,Prof. René Döring,2024-09-22 18:33:29,Regal-6
Buch,Betty Gierschner,Erde gegen Garten.,,Horror,978-0-17-649353-0,Pierre Henck,,Regal-10
Buch,Björn Kreusel,Ihm beide bei überall.,,Comedy,978-0-7384-8747-2,Ildiko Beckmann,2024-07-09 07:22:25,Regal-6
CD,Dipl.-Ing. Anett Römer,Beim schicken mögen.,Unser frei kalt jung nächste ohne.,Roman,9920378283007,Gabriele Noack,2024-01-27 14:50:08,Regal-9
Buch,Geert Beer,Darin Stück.,,Sachbuch,978-0-459-60063-1,Caterina Bachmann,2024-09-23 16:48:02,Regal-1
CD,Silvio Trupp,Früh rot.,Geschichte seit krank aber.,Pop,7582213183693,Jose Schuster,,Regal-4
DVD,Dipl.-Ing. Nicole Gumprich,Möglich Dorf nichts.,,Roman,9960333389139,Univ.Prof. Ludwina Wende B.Eng.,,Regal-9
CD,Geraldine Seifert,Bringen Schuh kochen arbeiten verstehen.,Wohnen weg Erde Pferd denken zur.,Comedy,2648115524356,Elzbieta Ring,,Regal-9
CD,Ing. Egon Steinberg,Himmel das hören.,Gab später Freund.,Pop,7554149876840,Cäcilie Junck,,Regal-6
Buch,Felix Gierschner-Säuberlich,Platz stark Seite.,,Punkrock,978-0-662-39902-5,Dr. Nikola Etzold B.A.,,Regal-9
CD,Cetin Hamann,Warten schlecht schwarz Frage.,Ohne Eltern langsam.,Horror,2401213217359,Ing. Katherina Jüttner MBA.,,Regal-5
CD,Harald Reuter,Wissen Sohn hin einige Berg.,Nichts klein schreien dauern öffnen fehlen essen.,Horror,2636094467900,Alan Bärer,,Regal-6
Buch,Peter-Michael Rosemann,Weinen neu wirklich der groß.,,Sachbuch,978-0-18-911837-6,Ruthild Schottin,2024-06-21 04:28:32,Regal-1
CD,Hella Johann B.A.,Winter Bein gut danach.,Schlecht schlimm Brot leicht Schwester unter.,Pop,6903081030604,Liane Gotthard B.A.,,Regal-5
DVD,Gertrude Jungfer,Etwas stark wirklich.,,Comedy,7772886971851,Herr Diedrich Sorgatz B.A.,,Regal-9
DVD,Baldur Stroh B.A.,Monat alle Loch.,,Comedy,6127956162560,Prof. Theodora Drubin,,Regal-1
Buch,Ruben Wähner,Vielleicht selbst.,,Horror,978-0-15-765345-8,Dipl.-Ing. Bernd Römer,,Regal-4
DVD,Helga Söding-Paffrath,Sitzen erst werden uns lustig.,,Comedy,3399290119118,Marcus Barkholz B.Eng.,2024-08-03 03:50:41,Regal-6
DVD,Gerfried Bohnbach,Ende rufen dir dein.,,Comedy,8904107845552,Thoralf Keudel,2024-01-19 03:43:36,Regal-7
DVD,Marliese auch Schlauchin MBA.,Selbst dumm besser Angst ich.,,Punkrock,6174597059797,Mohammed Beier,2024-09-24 03:41:32,Regal-3
DVD,Udo Pruschke,Sonst haben Mann hinein Stück.,,Roman,1590579271332,Herr Hansjörg Schwital B.Eng.,,Regal-6
CD,Philippe Gumprich,Finden lieb.,Nicht dumm Hund vielleicht.,Roman,0936636910829,Ing. Irmtrud Killer,2024-06-20 17:20:32,Regal-7
Buch,Prof. Hansjörg Löchel MBA.,Klein lesen oft.,,Roman,978-0-17-669538-5,Waltraut Trüb,2024-02-11 18:13:18,Regal-3
CD,Jerzy Scholl-Schleich,Rechnen fährt dabei sprechen krank.,Werden Teller Bild für dunkel dazu packen öffnen.,Punkrock,9961153464860,Hansgeorg Patberg,2024-05-07 06:44:15,Regal-5
